{
  "name": "HAPPY",
  "description": "Happy emotion - hands moving up at chest",
  "category": "emotions",
  "tags": ["feeling", "emotion"],
  "frames": 30,
  "keyframes": [
    {
      "time": 0.0,
      "pose": {
        "LEFT_SHOULDER": [0.45, 0.5],
        "LEFT_ELBOW": [0.43, 0.48],
        "LEFT_WRIST": [0.42, 0.45],
        "RIGHT_SHOULDER": [0.55, 0.5],
        "RIGHT_ELBOW": [0.57, 0.48],
        "RIGHT_WRIST": [0.58, 0.45]
      }
    },
    {
      "time": 0.5,
      "pose": {
        "LEFT_SHOULDER": [0.45, 0.5],
        "LEFT_ELBOW": [0.43, 0.48],
        "LEFT_WRIST": [0.42, 0.42],
        "RIGHT_SHOULDER": [0.55, 0.5],
        "RIGHT_ELBOW": [0.57, 0.48],
        "RIGHT_WRIST": [0.58, 0.42]
      }
    },
    {
      "time": 1.0,
      "pose": {
        "LEFT_SHOULDER": [0.45, 0.5],
        "LEFT_ELBOW": [0.43, 0.48],
        "LEFT_WRIST": [0.42, 0.45],
        "RIGHT_SHOULDER": [0.55, 0.5],
        "RIGHT_ELBOW": [0.57, 0.48],
        "RIGHT_WRIST": [0.58, 0.45]
      }
    }
  ]
}
