{
  "name": "LIKE",
  "description": "Like - hand pulling from chest",
  "category": "verbs",
  "tags": ["emotion", "preference"],
  "frames": 30,
  "keyframes": [
    {
      "time": 0.0,
      "pose": {
        "LEFT_SHOULDER": [0.45, 0.5],
        "LEFT_ELBOW": [0.45, 0.45],
        "LEFT_WRIST": [0.45, 0.4],
        "RIGHT_SHOULDER": [0.55, 0.5],
        "RIGHT_ELBOW": [0.53, 0.47],
        "RIGHT_WRIST": [0.52, 0.46]
      }
    },
    {
      "time": 0.5,
      "pose": {
        "LEFT_SHOULDER": [0.45, 0.5],
        "LEFT_ELBOW": [0.45, 0.45],
        "LEFT_WRIST": [0.45, 0.4],
        "RIGHT_SHOULDER": [0.55, 0.5],
        "RIGHT_ELBOW": [0.54, 0.45],
        "RIGHT_WRIST": [0.54, 0.43]
      }
    },
    {
      "time": 1.0,
      "pose": {
        "LEFT_SHOULDER": [0.45, 0.5],
        "LEFT_ELBOW": [0.45, 0.45],
        "LEFT_WRIST": [0.45, 0.4],
        "RIGHT_SHOULDER": [0.55, 0.5],
        "RIGHT_ELBOW": [0.55, 0.44],
        "RIGHT_WRIST": [0.56, 0.41]
      }
    }
  ]
}
