{
  "name": "FINISH",
  "description": "ASL sign for 'finish'",
  "category": "other",
  "tags": [],
  "frames": 30,
  "keyframes": [
    {
      "time": 0.0,
      "pose": {
        "RIGHT_SHOULDER": [
          0.55,
          0.5
        ],
        "LEFT_WRIST": [
          0.45,
          0.4
        ],
        "RIGHT_ELBOW": [
          0.55,
          0.45
        ],
        "LEFT_SHOULDER": [
          0.45,
          0.5
        ],
        "RIGHT_WRIST": [
          0.55,
          0.4
        ],
        "LEFT_ELBOW": [
          0.45,
          0.45
        ]
      }
    },
    {
      "time": 0.2413793103448276,
      "pose": {
        "RIGHT_SHOULDER": [
          0.55,
          0.5
        ],
        "LEFT_WRIST": [
          0.4266666666666667,
          0.4116666666666667
        ],
        "RIGHT_ELBOW": [
          0.55,
          0.45
        ],
        "LEFT_SHOULDER": [
          0.45,
          0.5
        ],
        "RIGHT_WRIST": [
          0.5733333333333334,
          0.4116666666666667
        ],
        "LEFT_ELBOW": [
          0.45,
          0.45
        ]
      }
    },
    {
      "time": 0.4827586206896552,
      "pose": {
        "RIGHT_SHOULDER": [
          0.55,
          0.5
        ],
        "LEFT_WRIST": [
          0.4033333333333333,
          0.42333333333333334
        ],
        "RIGHT_ELBOW": [
          0.55,
          0.45
        ],
        "LEFT_SHOULDER": [
          0.45,
          0.5
        ],
        "RIGHT_WRIST": [
          0.5966666666666667,
          0.42333333333333334
        ],
        "LEFT_ELBOW": [
          0.45,
          0.45
        ]
      }
    },
    {
      "time": 0.7241379310344828,
      "pose": {
        "RIGHT_SHOULDER": [
          0.55,
          0.5
        ],
        "LEFT_WRIST": [
          0.38,
          0.435
        ],
        "RIGHT_ELBOW": [
          0.55,
          0.45
        ],
        "LEFT_SHOULDER": [
          0.45,
          0.5
        ],
        "RIGHT_WRIST": [
          0.62,
          0.435
        ],
        "LEFT_ELBOW": [
          0.45,
          0.45
        ]
      }
    },
    {
      "time": 1.0,
      "pose": {
        "RIGHT_SHOULDER": [
          0.55,
          0.5
        ],
        "LEFT_WRIST": [
          0.35333333333333333,
          0.44833333333333336
        ],
        "RIGHT_ELBOW": [
          0.55,
          0.45
        ],
        "LEFT_SHOULDER": [
          0.45,
          0.5
        ],
        "RIGHT_WRIST": [
          0.6466666666666667,
          0.44833333333333336
        ],
        "LEFT_ELBOW": [
          0.45,
          0.45
        ]
      }
    }
  ]
}