{
  "name": "HELLO",
  "description": "Greeting gesture - signing 'hello'",
  "category": "greetings",
  "tags": [],
  "frames": 30,
  "keyframes": [
    {
      "time": 0.0,
      "pose": {
        "RIGHT_SHOULDER": [
          0.55,
          0.5
        ],
        "LEFT_WRIST": [
          0.45,
          0.4
        ],
        "RIGHT_ELBOW": [
          0.55,
          0.45
        ],
        "LEFT_SHOULDER": [
          0.45,
          0.5
        ],
        "RIGHT_WRIST": [
          0.6,
          0.4
        ],
        "LEFT_ELBOW": [
          0.45,
          0.45
        ]
      }
    },
    {
      "time": 0.2413793103448276,
      "pose": {
        "RIGHT_SHOULDER": [
          0.55,
          0.5
        ],
        "LEFT_WRIST": [
          0.45,
          0.4
        ],
        "RIGHT_ELBOW": [
          0.55,
          0.45
        ],
        "LEFT_SHOULDER": [
          0.45,
          0.5
        ],
        "RIGHT_WRIST": [
          0.6103955845408879,
          0.4
        ],
        "LEFT_ELBOW": [
          0.45,
          0.45
        ]
      }
    },
    {
      "time": 0.4827586206896552,
      "pose": {
        "RIGHT_SHOULDER": [
          0.55,
          0.5
        ],
        "LEFT_WRIST": [
          0.45,
          0.4
        ],
        "RIGHT_ELBOW": [
          0.55,
          0.45
        ],
        "LEFT_SHOULDER": [
          0.45,
          0.5
        ],
        "RIGHT_WRIST": [
          0.57966316784621,
          0.4
        ],
        "LEFT_ELBOW": [
          0.45,
          0.45
        ]
      }
    },
    {
      "time": 0.7241379310344828,
      "pose": {
        "RIGHT_SHOULDER": [
          0.55,
          0.5
        ],
        "LEFT_WRIST": [
          0.45,
          0.4
        ],
        "RIGHT_ELBOW": [
          0.55,
          0.45
        ],
        "LEFT_SHOULDER": [
          0.45,
          0.5
        ],
        "RIGHT_WRIST": [
          0.6293892626146237,
          0.4
        ],
        "LEFT_ELBOW": [
          0.45,
          0.45
        ]
      }
    },
    {
      "time": 1.0,
      "pose": {
        "RIGHT_SHOULDER": [
          0.55,
          0.5
        ],
        "LEFT_WRIST": [
          0.45,
          0.4
        ],
        "RIGHT_ELBOW": [
          0.55,
          0.45
        ],
        "LEFT_SHOULDER": [
          0.45,
          0.5
        ],
        "RIGHT_WRIST": [
          0.57966316784621,
          0.4
        ],
        "LEFT_ELBOW": [
          0.45,
          0.45
        ]
      }
    }
  ]
}