{
  "name": "NAME",
  "description": "Pronoun - signing 'name'",
  "category": "pronouns",
  "tags": [],
  "frames": 30,
  "keyframes": [
    {
      "time": 0.0,
      "pose": {
        "RIGHT_SHOULDER": [
          0.55,
          0.5
        ],
        "LEFT_WRIST": [
          0.45,
          0.4
        ],
        "RIGHT_ELBOW": [
          0.55,
          0.45
        ],
        "LEFT_SHOULDER": [
          0.45,
          0.5
        ],
        "RIGHT_WRIST": [
          0.52,
          0.35
        ],
        "LEFT_ELBOW": [
          0.45,
          0.45
        ]
      }
    },
    {
      "time": 0.2413793103448276,
      "pose": {
        "RIGHT_SHOULDER": [
          0.55,
          0.5
        ],
        "LEFT_WRIST": [
          0.45,
          0.4
        ],
        "RIGHT_ELBOW": [
          0.55,
          0.45
        ],
        "LEFT_SHOULDER": [
          0.45,
          0.5
        ],
        "RIGHT_WRIST": [
          0.52,
          0.33010956209263453
        ],
        "LEFT_ELBOW": [
          0.45,
          0.45
        ]
      }
    },
    {
      "time": 0.4827586206896552,
      "pose": {
        "RIGHT_SHOULDER": [
          0.55,
          0.5
        ],
        "LEFT_WRIST": [
          0.45,
          0.4
        ],
        "RIGHT_ELBOW": [
          0.55,
          0.45
        ],
        "LEFT_SHOULDER": [
          0.45,
          0.5
        ],
        "RIGHT_WRIST": [
          0.52,
          0.3458417661836448
        ],
        "LEFT_ELBOW": [
          0.45,
          0.45
        ]
      }
    },
    {
      "time": 0.7241379310344828,
      "pose": {
        "RIGHT_SHOULDER": [
          0.55,
          0.5
        ],
        "LEFT_WRIST": [
          0.45,
          0.4
        ],
        "RIGHT_ELBOW": [
          0.55,
          0.45
        ],
        "LEFT_SHOULDER": [
          0.45,
          0.5
        ],
        "RIGHT_WRIST": [
          0.52,
          0.3309788696740969
        ],
        "LEFT_ELBOW": [
          0.45,
          0.45
        ]
      }
    },
    {
      "time": 1.0,
      "pose": {
        "RIGHT_SHOULDER": [
          0.55,
          0.5
        ],
        "LEFT_WRIST": [
          0.45,
          0.4
        ],
        "RIGHT_ELBOW": [
          0.55,
          0.45
        ],
        "LEFT_SHOULDER": [
          0.45,
          0.5
        ],
        "RIGHT_WRIST": [
          0.52,
          0.34584176618364476
        ],
        "LEFT_ELBOW": [
          0.45,
          0.45
        ]
      }
    }
  ]
}