{
  "name": "GO",
  "description": "ASL sign for 'go'",
  "category": "verbs",
  "tags": [],
  "frames": 30,
  "keyframes": [
    {
      "time": 0.0,
      "pose": {
        "RIGHT_SHOULDER": [
          0.55,
          0.5
        ],
        "LEFT_WRIST": [
          0.45,
          0.4
        ],
        "RIGHT_ELBOW": [
          0.55,
          0.45
        ],
        "LEFT_SHOULDER": [
          0.45,
          0.5
        ],
        "RIGHT_WRIST": [
          0.5,
          0.45
        ],
        "LEFT_ELBOW": [
          0.45,
          0.45
        ]
      }
    },
    {
      "time": 0.2413793103448276,
      "pose": {
        "RIGHT_SHOULDER": [
          0.55,
          0.5
        ],
        "LEFT_WRIST": [
          0.45,
          0.4
        ],
        "RIGHT_ELBOW": [
          0.55,
          0.45
        ],
        "LEFT_SHOULDER": [
          0.45,
          0.5
        ],
        "RIGHT_WRIST": [
          0.5466666666666666,
          0.45
        ],
        "LEFT_ELBOW": [
          0.45,
          0.45
        ]
      }
    },
    {
      "time": 0.4827586206896552,
      "pose": {
        "RIGHT_SHOULDER": [
          0.55,
          0.5
        ],
        "LEFT_WRIST": [
          0.45,
          0.4
        ],
        "RIGHT_ELBOW": [
          0.55,
          0.45
        ],
        "LEFT_SHOULDER": [
          0.45,
          0.5
        ],
        "RIGHT_WRIST": [
          0.5933333333333334,
          0.45
        ],
        "LEFT_ELBOW": [
          0.45,
          0.45
        ]
      }
    },
    {
      "time": 0.7241379310344828,
      "pose": {
        "RIGHT_SHOULDER": [
          0.55,
          0.5
        ],
        "LEFT_WRIST": [
          0.45,
          0.4
        ],
        "RIGHT_ELBOW": [
          0.55,
          0.45
        ],
        "LEFT_SHOULDER": [
          0.45,
          0.5
        ],
        "RIGHT_WRIST": [
          0.64,
          0.45
        ],
        "LEFT_ELBOW": [
          0.45,
          0.45
        ]
      }
    },
    {
      "time": 1.0,
      "pose": {
        "RIGHT_SHOULDER": [
          0.55,
          0.5
        ],
        "LEFT_WRIST": [
          0.45,
          0.4
        ],
        "RIGHT_ELBOW": [
          0.55,
          0.45
        ],
        "LEFT_SHOULDER": [
          0.45,
          0.5
        ],
        "RIGHT_WRIST": [
          0.6933333333333334,
          0.45
        ],
        "LEFT_ELBOW": [
          0.45,
          0.45
        ]
      }
    }
  ]
}