{
  "name": "PEOPLE",
  "description": "People/group - alternating P handshapes",
  "category": "nouns",
  "tags": ["person", "group"],
  "frames": 30,
  "keyframes": [
    {
      "time": 0.0,
      "pose": {
        "LEFT_SHOULDER": [0.45, 0.5],
        "LEFT_ELBOW": [0.43, 0.45],
        "LEFT_WRIST": [0.41, 0.42],
        "RIGHT_SHOULDER": [0.55, 0.5],
        "RIGHT_ELBOW": [0.55, 0.45],
        "RIGHT_WRIST": [0.55, 0.42]
      }
    },
    {
      "time": 0.25,
      "pose": {
        "LEFT_SHOULDER": [0.45, 0.5],
        "LEFT_ELBOW": [0.43, 0.45],
        "LEFT_WRIST": [0.42, 0.43],
        "RIGHT_SHOULDER": [0.55, 0.5],
        "RIGHT_ELBOW": [0.55, 0.45],
        "RIGHT_WRIST": [0.54, 0.41]
      }
    },
    {
      "time": 0.5,
      "pose": {
        "LEFT_SHOULDER": [0.45, 0.5],
        "LEFT_ELBOW": [0.45, 0.45],
        "LEFT_WRIST": [0.45, 0.42],
        "RIGHT_SHOULDER": [0.55, 0.5],
        "RIGHT_ELBOW": [0.57, 0.45],
        "RIGHT_WRIST": [0.59, 0.42]
      }
    },
    {
      "time": 0.75,
      "pose": {
        "LEFT_SHOULDER": [0.45, 0.5],
        "LEFT_ELBOW": [0.43, 0.45],
        "LEFT_WRIST": [0.42, 0.43],
        "RIGHT_SHOULDER": [0.55, 0.5],
        "RIGHT_ELBOW": [0.56, 0.45],
        "RIGHT_WRIST": [0.57, 0.41]
      }
    },
    {
      "time": 1.0,
      "pose": {
        "LEFT_SHOULDER": [0.45, 0.5],
        "LEFT_ELBOW": [0.43, 0.45],
        "LEFT_WRIST": [0.41, 0.42],
        "RIGHT_SHOULDER": [0.55, 0.5],
        "RIGHT_ELBOW": [0.55, 0.45],
        "RIGHT_WRIST": [0.55, 0.42]
      }
    }
  ]
}
