{
  "name": "FAMILY",
  "description": "Family - F handshapes circling",
  "category": "nouns",
  "tags": ["people", "relationships"],
  "frames": 30,
  "keyframes": [
    {
      "time": 0.0,
      "pose": {
        "LEFT_SHOULDER": [0.45, 0.5],
        "LEFT_ELBOW": [0.43, 0.44],
        "LEFT_WRIST": [0.4, 0.42],
        "RIGHT_SHOULDER": [0.55, 0.5],
        "RIGHT_ELBOW": [0.57, 0.44],
        "RIGHT_WRIST": [0.6, 0.42]
      }
    },
    {
      "time": 0.33,
      "pose": {
        "LEFT_SHOULDER": [0.45, 0.5],
        "LEFT_ELBOW": [0.42, 0.45],
        "LEFT_WRIST": [0.41, 0.44],
        "RIGHT_SHOULDER": [0.55, 0.5],
        "RIGHT_ELBOW": [0.58, 0.45],
        "RIGHT_WRIST": [0.59, 0.44]
      }
    },
    {
      "time": 0.66,
      "pose": {
        "LEFT_SHOULDER": [0.45, 0.5],
        "LEFT_ELBOW": [0.43, 0.46],
        "LEFT_WRIST": [0.43, 0.46],
        "RIGHT_SHOULDER": [0.55, 0.5],
        "RIGHT_ELBOW": [0.57, 0.46],
        "RIGHT_WRIST": [0.57, 0.46]
      }
    },
    {
      "time": 1.0,
      "pose": {
        "LEFT_SHOULDER": [0.45, 0.5],
        "LEFT_ELBOW": [0.43, 0.44],
        "LEFT_WRIST": [0.4, 0.42],
        "RIGHT_SHOULDER": [0.55, 0.5],
        "RIGHT_ELBOW": [0.57, 0.44],
        "RIGHT_WRIST": [0.6, 0.42]
      }
    }
  ]
}
