{
  "name": "FEEL",
  "description": "Feel - hand moving up center chest",
  "category": "verbs",
  "tags": ["emotion", "mental"],
  "frames": 30,
  "keyframes": [
    {
      "time": 0.0,
      "pose": {
        "LEFT_SHOULDER": [0.45, 0.5],
        "LEFT_ELBOW": [0.45, 0.45],
        "LEFT_WRIST": [0.45, 0.40],
        "RIGHT_SHOULDER": [0.55, 0.5],
        "RIGHT_ELBOW": [0.52, 0.47],
        "RIGHT_WRIST": [0.50, 0.48]
      }
    },
    {
      "time": 0.5,
      "pose": {
        "LEFT_SHOULDER": [0.45, 0.5],
        "LEFT_ELBOW": [0.45, 0.45],
        "LEFT_WRIST": [0.45, 0.40],
        "RIGHT_SHOULDER": [0.55, 0.5],
        "RIGHT_ELBOW": [0.52, 0.45],
        "RIGHT_WRIST": [0.50, 0.44]
      }
    },
    {
      "time": 1.0,
      "pose": {
        "LEFT_SHOULDER": [0.45, 0.5],
        "LEFT_ELBOW": [0.45, 0.45],
        "LEFT_WRIST": [0.45, 0.40],
        "RIGHT_SHOULDER": [0.55, 0.5],
        "RIGHT_ELBOW": [0.52, 0.46],
        "RIGHT_WRIST": [0.50, 0.46]
      }
    }
  ]
}
