{
  "name": "CAN",
  "description": "Can/able - S hands moving down",
  "category": "verbs",
  "tags": ["modal", "ability"],
  "frames": 30,
  "keyframes": [
    {
      "time": 0.0,
      "pose": {
        "LEFT_SHOULDER": [0.45, 0.5],
        "LEFT_ELBOW": [0.45, 0.46],
        "LEFT_WRIST": [0.45, 0.42],
        "RIGHT_SHOULDER": [0.55, 0.5],
        "RIGHT_ELBOW": [0.55, 0.46],
        "RIGHT_WRIST": [0.55, 0.42]
      }
    },
    {
      "time": 0.5,
      "pose": {
        "LEFT_SHOULDER": [0.45, 0.5],
        "LEFT_ELBOW": [0.45, 0.47],
        "LEFT_WRIST": [0.45, 0.45],
        "RIGHT_SHOULDER": [0.55, 0.5],
        "RIGHT_ELBOW": [0.55, 0.47],
        "RIGHT_WRIST": [0.55, 0.45]
      }
    },
    {
      "time": 1.0,
      "pose": {
        "LEFT_SHOULDER": [0.45, 0.5],
        "LEFT_ELBOW": [0.45, 0.46],
        "LEFT_WRIST": [0.45, 0.42],
        "RIGHT_SHOULDER": [0.55, 0.5],
        "RIGHT_ELBOW": [0.55, 0.46],
        "RIGHT_WRIST": [0.55, 0.42]
      }
    }
  ]
}
