{
  "name": "GET",
  "description": "Get/receive - hands closing to grab",
  "category": "verbs",
  "tags": ["action", "receive"],
  "frames": 30,
  "keyframes": [
    {
      "time": 0.0,
      "pose": {
        "LEFT_SHOULDER": [0.45, 0.5],
        "LEFT_ELBOW": [0.42, 0.45],
        "LEFT_WRIST": [0.4, 0.42],
        "RIGHT_SHOULDER": [0.55, 0.5],
        "RIGHT_ELBOW": [0.58, 0.45],
        "RIGHT_WRIST": [0.6, 0.42]
      }
    },
    {
      "time": 0.5,
      "pose": {
        "LEFT_SHOULDER": [0.45, 0.5],
        "LEFT_ELBOW": [0.45, 0.46],
        "LEFT_WRIST": [0.47, 0.44],
        "RIGHT_SHOULDER": [0.55, 0.5],
        "RIGHT_ELBOW": [0.55, 0.46],
        "RIGHT_WRIST": [0.53, 0.44]
      }
    },
    {
      "time": 1.0,
      "pose": {
        "LEFT_SHOULDER": [0.45, 0.5],
        "LEFT_ELBOW": [0.46, 0.47],
        "LEFT_WRIST": [0.48, 0.45],
        "RIGHT_SHOULDER": [0.55, 0.5],
        "RIGHT_ELBOW": [0.54, 0.47],
        "RIGHT_WRIST": [0.52, 0.45]
      }
    }
  ]
}
