{
  "name": "THINK",
  "description": "Think - index finger at temple",
  "category": "verbs",
  "tags": ["mental", "cognitive"],
  "frames": 30,
  "keyframes": [
    {
      "time": 0.0,
      "pose": {
        "LEFT_SHOULDER": [0.45, 0.5],
        "LEFT_ELBOW": [0.45, 0.45],
        "LEFT_WRIST": [0.45, 0.4],
        "RIGHT_SHOULDER": [0.55, 0.5],
        "RIGHT_ELBOW": [0.56, 0.42],
        "RIGHT_WRIST": [0.56, 0.33]
      }
    },
    {
      "time": 0.5,
      "pose": {
        "LEFT_SHOULDER": [0.45, 0.5],
        "LEFT_ELBOW": [0.45, 0.45],
        "LEFT_WRIST": [0.45, 0.4],
        "RIGHT_SHOULDER": [0.55, 0.5],
        "RIGHT_ELBOW": [0.56, 0.42],
        "RIGHT_WRIST": [0.57, 0.32]
      }
    },
    {
      "time": 1.0,
      "pose": {
        "LEFT_SHOULDER": [0.45, 0.5],
        "LEFT_ELBOW": [0.45, 0.45],
        "LEFT_WRIST": [0.45, 0.4],
        "RIGHT_SHOULDER": [0.55, 0.5],
        "RIGHT_ELBOW": [0.56, 0.42],
        "RIGHT_WRIST": [0.56, 0.33]
      }
    }
  ]
}
