{
  "name": "MAYBE",
  "description": "Maybe - hands alternating up and down",
  "category": "adverbs",
  "tags": ["uncertainty", "possibility"],
  "frames": 30,
  "keyframes": [
    {
      "time": 0.0,
      "pose": {
        "LEFT_SHOULDER": [0.45, 0.5],
        "LEFT_ELBOW": [0.43, 0.46],
        "LEFT_WRIST": [0.42, 0.44],
        "RIGHT_SHOULDER": [0.55, 0.5],
        "RIGHT_ELBOW": [0.57, 0.48],
        "RIGHT_WRIST": [0.58, 0.48]
      }
    },
    {
      "time": 0.33,
      "pose": {
        "LEFT_SHOULDER": [0.45, 0.5],
        "LEFT_ELBOW": [0.43, 0.48],
        "LEFT_WRIST": [0.42, 0.48],
        "RIGHT_SHOULDER": [0.55, 0.5],
        "RIGHT_ELBOW": [0.57, 0.46],
        "RIGHT_WRIST": [0.58, 0.44]
      }
    },
    {
      "time": 0.66,
      "pose": {
        "LEFT_SHOULDER": [0.45, 0.5],
        "LEFT_ELBOW": [0.43, 0.46],
        "LEFT_WRIST": [0.42, 0.44],
        "RIGHT_SHOULDER": [0.55, 0.5],
        "RIGHT_ELBOW": [0.57, 0.48],
        "RIGHT_WRIST": [0.58, 0.48]
      }
    },
    {
      "time": 1.0,
      "pose": {
        "LEFT_SHOULDER": [0.45, 0.5],
        "LEFT_ELBOW": [0.43, 0.47],
        "LEFT_WRIST": [0.42, 0.46],
        "RIGHT_SHOULDER": [0.55, 0.5],
        "RIGHT_ELBOW": [0.57, 0.47],
        "RIGHT_WRIST": [0.58, 0.46]
      }
    }
  ]
}
